,,,
Country,1990 PM2.5 Deaths,2023 PM2.5 Deaths,Trend Summary
China,"462,800","1,790,000","Dramatic Increase. PM2.5 is the dominant driver of China's air pollution deaths. It increased by nearly 400%, despite a decline in total air pollution deaths."
India,"246,500","969,700",Substantial Increase. The PM2.5 death burden has increased almost 4 times by demonstrating the growing crisis of outdoor air quality.
Nigeria,"39,300","81,600","Steady Growth. The burden more than doubled, reflecting ongoing urbanization and increasing outdoor pollution exposure."
USA,"177,300","69,700",Significant Decline. PM2.5 deaths have been reduced by over 60% showing the success of continous regulatory measures in high-income nations.
Pakistan,"41,500","99,100",Steep Increase. The burden more than doubled which highlights an emerging major health challenge in this region.
